<?xml version="1.0" encoding="UTF-8" standalone="no"?>
<xs:schema xmlns:tns="http://lang.whole.org/MT3.001.01/" xmlns:xs="http://www.w3.org/2001/XMLSchema" elementFormDefault="qualified" targetNamespace="http://lang.whole.org/MT3.001.01/">

    <xs:element name="document" type="tns:Document"/>
    
    <xs:complexType name="Document">
    	<xs:sequence>
    		<xs:element name="groupHeader" type="tns:GroupHeader"/>
    		<xs:element maxOccurs="unbounded" minOccurs="0" name="messages" type="tns:MessageType"/>
    	</xs:sequence>
    </xs:complexType>

    <xs:complexType name="GroupHeader">
    	<xs:sequence>
    		<xs:element name="grpId" type="xs:string"/>
    		<xs:element name="currDate" type="xs:string"/>
    		<xs:element name="totAmount" type="xs:string"/>
    		<xs:element name="nOfMsgs" type="xs:int"/>
    	</xs:sequence>
    </xs:complexType>
    
    <xs:complexType name="MessageType">
    	<xs:sequence>
    		<xs:element name="id" type="xs:string"/>
    		<xs:element name="amount" type="xs:string"/>
    		<xs:element name="debitor" type="tns:DebitorType"/>
    	</xs:sequence>
    </xs:complexType>

    <xs:complexType name="DebitorType">
    	<xs:choice>
    		<xs:element name="bic" type="xs:string"/>
    		<xs:element name="personId" type="tns:PersonId"/>
    	</xs:choice>
    </xs:complexType>

    <xs:complexType name="PersonId">
    	<xs:sequence>
    		<xs:element name="name" type="xs:string"/>
    		<xs:element name="dateOfBirth" type="xs:string"/>
    	</xs:sequence>
    </xs:complexType>
</xs:schema>
