<?xml version="1.0" encoding="UTF-8"?>
<document xmlns="http://lang.whole.org/MT3.001.01/"
		xmlns:xsi="http://www.w3.org/2001/XMLSchema-instance"
		xsi:schemaLocation="http://lang.whole.org/MT3.001.01/ ChoiceSample.xsd">

    <groupHeader>
        <grpId>ID:001</grpId>
        <currDate>23/10/2008</currDate>
        <totAmount>1000.00</totAmount>
        <nOfMsgs>2</nOfMsgs>
    </groupHeader>
    <messages>
        <id>ID:002</id>
        <amount>500.50</amount>
        <debitor>
        	<bic>ABNANAL02XX</bic>
        </debitor>
    </messages>
    <messages>
        <id>ID:003</id>
        <amount>499.50</amount>
        <debitor>
	        <bic>ABNANAL02XX</bic>
        </debitor>
    </messages>
</document>
